Text,Score,Comments,Timestamp,Media_Type
learning is for everyone.,89485,595,2024-08-17 03:32:12,Image
That's actually a pretty good idea,89489,677,2024-11-02 13:14:34,Image
"Buried treasure, including nearly 200 Roman coins, found in Italy",89463,1546,2024-08-23 15:52:25,Text
Little girl savagely humbles a guy in front of his friends in a 1v1 football match,89437,482,2024-08-18 00:38:26,Text
Why is he even allowed to compete?,89339,6685,2024-06-26 00:22:46,Text
Find the value of X,89307,447,2024-10-08 12:11:13,Text
"I gave in today. If you’re reading this, this is your sign to just do it.",89294,12964,2024-01-13 18:43:16,Text
Sometimes it’s too easy,89217,5610,2024-11-13 04:21:54,Text
Man casually builds a dam all by himself,89134,3876,2024-01-07 10:00:13,Text
Entire library is empty. Random girl came and sat RIGHT next to me.,89142,8355,2024-03-07 09:38:33,Text
Human skull with stage 1 bone cancer,89117,3137,2024-04-21 13:20:52,Text
Big snail I found. Foot for scale,89076,1967,2024-09-26 13:48:23,Text
Caught a mouse and it gave birth inside the trap,89070,4790,2024-09-18 14:59:42,Text
me_irl [Art Source](https://www.deviantart.com/izaru/art/osy057-s-Scooby-Doo-colored-35809198),89041,1039,2024-10-09 06:03:59,Image
Jan 6 in capitol: Mike Pence watches video of Trump praising the rioters as his daughter looks on.,88981,4216,2024-09-23 21:11:06,Text
Obama makes a dick joke about Trump at the DNC,88975,4971,2024-08-21 03:28:28,Text
What do you mean? Nothing happened,88931,1130,2024-09-07 10:26:24,Image
"Oof. 100% on point, but oof",88828,2713,2024-08-27 21:39:13,Text
My Dad woke up to a sewer crab in the toilet this morning. (We live in a tropical climate),96939,7788,2024-11-21 16:50:58,Text
meirl,88744,1113,2024-11-15 09:37:04,Text
"19-year-old Brandon Swanson drove his car into a ditch on his way home from a party on May 14th, 2008, but was uninjured, as he'd tell his parents on the phone. Nearly 50 minutes into the call, he suddenly exclaimed ""Oh, shit!"" and then went silent. He has never been seen or heard from again.",88706,4514,2024-08-31 00:55:30,Text
"oh hey, you're home early..",88682,549,2024-10-06 23:37:26,Text
No additional words needed,88676,6261,2024-07-02 00:13:34,Image
"$14,000 raise",88610,1898,2024-09-08 10:54:10,Image
Sen. Bernie Sanders wins a fourth term representing Vermont,88572,1676,2024-11-06 00:28:06,Text
Nice!,88561,760,2024-10-20 11:51:00,Image
My son’s angler fish costume for Halloween this year.,88557,575,2024-11-01 11:21:38,Text
Selective Divine Intervention?,88518,2080,2024-10-23 11:41:20,Text
Thank you Dreamwork,88511,1176,2024-10-01 21:39:54,Image
Who else belongs here ?,88448,737,2024-05-01 10:20:56,Image
Mask drama destroyed,89023,492,2024-11-18 04:25:24,Image
Jobs most Americans wouldn't do...,88444,847,2024-09-18 01:59:03,Text
So beautiful,88399,416,2024-10-05 07:17:27,Text
"This garlic doesn’t have separate cloves, it’s just one solid piece",88414,1419,2024-09-14 17:46:51,Text
Me irl,88398,454,2023-12-18 23:32:35,Image
People are finding mold in KSI's new Lunchly product,88388,5158,2024-10-21 15:23:17,Text
Surprise to her best friend for graduation. She did not expect it because she had not seen her for a long time as she had moved to another city,88352,703,2024-09-04 16:51:38,Text
Blaming young people for being triggered,88253,1080,2024-10-03 13:35:47,Text
Sorbo trying to figure it out,88233,1641,2024-09-12 03:12:39,Image
You are Gay!,88227,1024,2024-09-02 15:29:31,Text
Man in white shirt stands between Sydney mall mass stabber and a group of young kids,88229,6480,2024-04-13 10:16:26,Text
"1st place marathon runner takes wrong turn, but his competitor shows him respect",88222,1577,2024-09-07 08:44:26,Text
Imagine these dad vibes in the White House.,88180,3564,2024-08-06 15:51:35,Text
Two dogs digging a hole got busted by the owner.,88202,793,2024-04-30 03:47:49,Text
"After 17 years of being a vet, I still get impressed by some of my patients.",88159,710,2024-09-29 21:36:47,Text
"Nice try, Karen",87978,474,2024-09-28 12:25:55,Image
Canopy comes off airplane right after takeoff,88040,1945,2024-06-23 22:12:25,Text
A married couple posed together for a picture every year since they first met 12 years ago  🎥 - ktdang (Tik tok),88038,619,2024-11-16 19:26:14,Text
I am Titus,88030,241,2024-09-18 02:09:51,Text
Know the difference guys,87963,2394,2024-06-14 20:06:52,Text
meirl,87923,416,2024-09-04 19:54:04,Text
I had my suspicions….,87914,3454,2024-10-15 00:49:15,Text
JD Vance mocked as he blames Harris for eggs costing $4 while standing in front of a $2.99 display,87863,4469,2024-09-23 18:06:10,Text
"""Experimental forestry"" in Japan to measure the effect of tree density on growth",87777,416,2024-09-27 12:26:59,Image
"Saving ballots from arson in Vancouver, Washington this morning",87770,4861,2024-10-28 16:20:57,Text
"She failed her stunt and began crying, but her coach encouraged her to try again.",87743,1070,2024-11-17 10:04:25,Text
Wolf lived with a tree branch trapped between his teeth for years,87710,2057,2024-10-12 17:32:21,Text
Airport bathroom,87689,1920,2024-09-07 11:46:54,Image
Building fish tower in a pond,87693,1449,2024-02-29 19:04:10,Text
Backshot cave painting in Algeria (dated around 7-2000 BCE),87636,2180,2024-08-12 02:21:37,Text
Red Robin,87633,473,2024-05-14 22:32:26,Text
What joy,87545,608,2024-08-21 16:10:07,Text
He was eating somebody else’s leftovers but she took it away and gave him fresh food 🥺,87489,1768,2024-02-27 15:44:37,Text
"Physics is not boring, there are just people who don't know how to teach it, Newton's third law",87477,1144,2024-08-28 22:42:43,Text
Why does corporate think this is ok?  God forbid I get sick. Company doesn’t give a 💩,88026,10880,2024-11-20 07:53:57,Text
Well done Micheal,87379,877,2024-11-08 22:21:03,Image
Footage of meteor that was seen last night in Portugal.,87357,1314,2024-05-19 08:11:17,Text
VLC's creator refused several tens of millions of dollars to keep the software ads free.,87355,1285,2024-07-30 11:47:29,Image
The Emperor of Japan drove past me in Richmond.,87258,1832,2024-06-28 14:11:33,Text
Definitely not the first time,88201,796,2024-11-18 15:18:42,Text
Mount Rainer casting a shadow during the early morning sunrise,87186,370,2024-11-15 15:58:29,Text
This must be nice.,87169,953,2024-09-12 15:27:35,Image
"Woke up to this text from my uncle Got woken up at 5:30 AM to this message from my Uncle. I frantically called my dad (no answer) and scrolled Facebook looking for some news or something that my Uncle must have seen. Had a horrible 45 minute commute to work in traffic going over the relationship with my father, my regrets about time not spent together, and how my life would change without him. 

Only to get a call 2 hours later from my dad asking me why I was calling him 5:30 am and if somebody had died smh.",87120,1103,2024-08-30 05:08:15,Text
Taiwan Badminton players exhausted after beating China for the gold,87081,1464,2024-08-05 23:08:16,Text
"If you can make 65,000 people sing in sync 33 years after your death, you're not a singer but legend",87055,1203,2024-11-02 06:00:30,Text
Cows have best friends and get stressed when they are separated.,87030,1274,2024-11-17 12:22:08,Text
Just a casual game of basketball with a magician,87013,471,2024-10-05 17:07:21,Text
What's next,86977,396,2024-10-19 20:15:18,Image
He's the man of the house now,86964,451,2024-10-16 16:24:00,Image
Australia...,86944,2356,2024-08-28 11:16:11,Image
"Before she passed my Mom would always text me at exactly 1:11a, the time I was born, to wish me happy birthday.",86732,2514,2024-10-29 15:10:18,Text
"Baby ""signs"" to deaf grandparents",86865,686,2024-07-04 12:58:25,Text
Keith bro played well,86866,1294,2024-11-09 09:53:16,Image
Mad inflation 💹.,86811,183,2024-11-02 14:21:28,Text
It really is this simple,86793,2188,2024-10-31 12:04:37,Text
Insult or fact?,86582,2075,2024-10-29 10:09:47,Text
"Once-in-a-lifetime-shot.
A bright meteor burned up in the atmosphere while capturing Andromeda Galaxy.",86684,357,2024-11-02 06:33:19,Image
Another School Shooting in America,86674,14815,2024-09-04 19:37:57,Text
Tips for being a dementia caretaker.,86672,2666,2024-04-09 15:30:29,Text
Alexandria Ocasio-Cortez helping to jump start a car on Capitol Plaza,86624,4513,2024-09-11 19:10:45,Text
The Onion wins Alex Jones' Infowars in bankruptcy auction,86608,2744,2024-11-14 14:09:46,Text
"This is project 2025 , and unless the people vote? This is america's future",86445,13592,2024-07-05 20:28:24,Text
The door to the dining area of the Alcobaça Monastery in Portugal was made narrow so that monks who got too fat were forced to go into fasting.,86542,544,2024-08-30 01:14:54,Text
Oh My God,86507,3715,2024-07-19 01:53:57,Text
Why can’t people just let others live their lives without feeling the need to interject.  Was left in a mailbox of a home display a Harris / Walz sign in suburb of Chicago. I guess someone’s upset…,86382,16557,2024-10-10 00:49:24,Text
Boomer parents voting like it's a high school yearbook,86404,8848,2024-10-07 07:30:25,Text
I found 1€ in my doner kebab,86385,4209,2024-11-14 07:05:07,Text
You can’t see me,86376,3142,2024-03-03 02:15:11,Text
"Trash left behind in aftermath of Trump rally in Butler, Pennsylvania",86375,9917,2024-10-06 17:48:30,Text
He saw it coming and yet he didn't.,86314,368,2024-08-24 01:44:21,Text
These grandkids planned to surprise their grandma at the airport dressing as t-rex but she heard about it and planned her own surprise.,86334,573,2024-09-30 11:24:10,Text
meirl,86273,1389,2024-11-05 13:27:39,Text
husband jokes,86264,186,2024-11-13 11:27:51,Text
how dare you make fun of my pp?,86253,4472,2024-08-09 16:36:34,Text
"Childless GOP candidate, Derrick Andersen, borrows friend’s wife and kids for photo op.",86123,3963,2024-09-28 10:14:49,Text
Why do some airbuses get slutty eye liner and some don't?,86152,1605,2024-11-11 14:31:51,Text
A South African man proposed to his gf at KFC and a journalist took picture and tried to shame him publicly. The backlash rained downed heavily on journalist  with multiple companies offering gifts to fund the couple’s dream wedding and support their new life together.,86151,1661,2024-10-02 21:22:13,Text
meirl,86048,545,2024-07-02 03:42:42,Text
Who Pays The Tariffs?,86030,2980,2024-11-04 19:49:33,Text
meirl,85981,1022,2024-10-31 12:13:49,Text
Taylor Swift Officially Endores Kamala Harris for US President 2024,85924,7034,2024-09-11 03:18:07,Text
Kitty saves itself from cobra attack,85927,2227,2024-03-22 00:44:53,Text
"In Cluj, Romania, you can pay for your bus ticket by doing 20 squats. Disabled and elderly people get to ride for free.",85903,675,2024-11-16 12:55:01,Image
Protect this man,85895,376,2024-07-20 12:28:46,Text
meirl,85878,358,2024-11-05 09:15:29,Image
"TIL the 9/11 rescue dogs became so depressed finding only dead bodies, rescue workers had to stage fake rescues to boost their morale",85867,1182,2024-09-11 16:21:36,Text
The way she grabbed his hand without hesitation.,85858,2050,2024-08-01 13:13:28,Text
Trumps makeup,85860,9552,2024-10-31 16:33:08,Text
A real wholesome playa,85855,673,2024-11-12 12:52:37,Text
A good brother,85828,407,2024-08-20 21:08:37,Text
Images from a Trump boat parade yesterday in Florida,85807,27053,2024-10-14 13:46:04,Text
Madlad is good at maths,85715,310,2024-10-15 14:59:34,Text
"Iranian student, goes half-naked defying the Hijab enforcers after they torn part of her clothing.",85704,1421,2024-11-02 15:29:16,Text
Bro got off from 15 hour shift and his wife said we’re all going out to eat,85623,1740,2024-07-08 13:42:41,Text
Found an interesting stick buried in the bushes outside of my house… am I hexed?,85541,3317,2024-10-02 21:59:37,Text
Meirl,85474,836,2024-10-02 02:35:54,Image
Workers Demand Pay...,85457,866,2024-10-08 06:24:17,Image
Richest man on earth by the way.,85269,4000,2024-10-29 15:27:10,Image
Here come the attacks… …and the rebuttals.,85361,8069,2024-08-07 11:57:06,Text
Imane Khelif bursts into tears following her victory against Luca Hamori from Hungary who attacked her on social media before the fight.,85308,2636,2024-08-03 16:17:38,Text
Who knows,85242,2375,2024-09-10 03:25:40,Text
meirl,85151,533,2024-08-28 23:20:04,Text
Ed sheeran offered a $2 show but nobody believed it,85126,1691,2024-10-07 06:59:54,Text
Illegal alien eating a cat on TV.,85104,909,2024-09-11 03:03:26,Text
Step dad thinks eclipse will kill us My step dad will not let me remove this thin foil for the entire week because he thinks the eclipse will kill us somehow and now the entire apartment looks like a cave (First photo is my room second is the kitchen/living room),85074,7317,2024-04-08 21:55:27,Text
Imane Khelif has won the gold medal at the Olympics in Paris.,85067,7771,2024-08-09 21:23:54,Text
the legend of cat dad,84990,374,2024-05-20 19:58:42,Text
I found a carcass of a bear that died from a tree falling on it,84861,1636,2024-09-28 17:15:43,Text
"MASERATI. (OC)  You do you.
https://www.instagram.com/davecontra",84927,677,2024-10-06 09:39:35,Text
Calls for J.D. Vance to resign after he admits that he created pet-eating story about immigrants,84919,3904,2024-09-15 20:42:01,Text
Lan party from 2003,84917,2621,2024-05-28 06:40:37,Text
The guy takes out a coyote hunting his sheep with a thermal-scoped sniper rifle.,84834,3408,2024-07-09 00:45:32,Text
American Madlads,84835,813,2024-10-20 13:43:46,Text
Brazilian paralympic swimmer Gabriel Araujo born with short legs and no arms obliterates the field in the 100m backstroke,84810,2077,2024-09-05 20:12:15,Text
"We took our terminally ill cat to see a final sunset We were told Max was had a few days at most left today. We aren't sure if he's going to have another night, so we wanted to make sure he got every bit of sun left today.",84761,1381,2024-05-17 00:21:57,Text
Based on a true story,84739,254,2024-10-24 12:41:05,Text
This is true.,84665,750,2024-09-22 04:53:25,Text
Took a selfie and noticed my husband in the background looking absolutely in love 🥹,84645,1395,2024-11-17 05:34:03,Text
"Sewed myself a jacket from old windsurfing sail bags The material is hydrophobic and windproof.
It's the first jacket I've ever made and I kinda love the result :D",84606,1144,2024-10-10 11:34:20,Image
meirl,84596,1300,2024-07-03 05:56:28,Text
Cutest way to order room service,84479,6854,2023-12-14 10:49:35,Text
Police digitally erase tattoos of suspect,84445,2081,2024-07-12 17:55:45,Text
Boy grows up to be air steward for China Eastern Airlines and has reunion with stewardess he met on a flight of the same airline 20 years ago,84428,1402,2024-10-21 01:19:22,Text
Million dollar shot of meteor entering atmosphere above Portugal,84351,615,2024-10-28 05:49:52,Text
Before and after the recent storm in Dubai. I now have a lake view apartment :D,84403,1374,2024-04-19 13:37:34,Image
Crows plucking ticks off wallabies like they're fat juicy grapes off the vine,84364,2191,2024-09-13 00:54:45,Text
kids are brutal,84465,253,2024-11-18 00:32:55,Text
"I left this cup in my car and after a couple days in the sun, the lid flattened out.",84230,671,2024-08-24 15:51:23,Text
"Man urinating on Trump's Scotland golf course sign, where he can no longer visit.",84272,2685,2024-06-01 18:50:40,Text
Well…. Shit.,84249,784,2024-09-01 20:02:37,Text
Nice gesture from the player,84216,475,2024-05-12 15:40:21,Text
Pregnant woman MRI scan of the Fetus.,84190,1680,2024-09-15 17:06:24,Text
"Monks clashing with police in Bangkok riots, November 2022",84166,1438,2024-10-31 15:35:25,Text
"My cousin and her kid are staying with us for a while, this is what she usually gives her 5yo son for breakfast Not to mention the mess she allows him to make that, although she does clean up after him, It’s not fun living in what seems like a consistently dirty home (she cleans at bedtime, it’s back to a mess by noon )",84158,6205,2024-03-19 18:24:40,Text
"Fukang meteorite that fell in the mountains near Fukang, China. It is estimated to be 4.5 billion years old",84126,4075,2024-05-22 14:45:07,Text
Beautiful moments exhibited in artwork,84128,400,2024-11-05 10:10:05,Text
"Walz's face during Harris' concession speech breaks my heart So much sadness and disappointment. I am literally moved to tears.

This is a real man right here. Not afraid to display real emotions. What this country just passed up on in favour of complete nasty hatred... 

 I can't",84091,382,2024-11-07 00:57:59,Text
A grown man and her wife,84090,1175,2024-10-24 14:34:31,Text
Defensive,84054,6213,2024-07-10 11:41:38,Text
Elephant pretends to eat this guys hat,84036,923,2024-09-08 00:18:18,Text
"I had an eraser in my head for 15 years.  I got this removed today, couldn't believe it was actually in there. I convinced myself it didn't happen.",84005,5125,2024-07-03 23:32:20,Text
Spotted in Downtown Dallas This Morning,84001,1530,2024-05-05 18:26:30,Text
"In Norway it is required by law to apply a standardized label to all advertising in which body shape, size, or skin is altered through retouching or other manipulation.",83939,1688,2024-05-26 07:30:47,Text
Caiman photographed just before feasting on his friend,83923,2336,2024-07-29 15:50:38,Text
"In a small town in County Cork, Ireland, a monument stands in appreciation to the American Choctaw Indian Tribe. Although impoverished, shortly after being forced to walk the Trail of Tears, the tribe somehow gathered $170 to send to Ireland for famine relief in 1847.",83889,676,2024-10-26 17:25:07,Text
He destroy everything,83888,528,2024-11-15 17:32:36,Text
"When Coca Cola announced it sold 4 times more than Pepsi in 2001, Pepsi responded with this commercial",83835,2081,2024-06-14 19:43:47,Text
Getting out of tight spot,83826,642,2024-07-20 19:59:39,Text
So THIS is was what crossed the line?,83737,1739,2024-09-16 21:57:41,Text
Different people have different needs,83720,326,2024-08-21 19:47:32,Text
"You'll watch this and go ""Hell yeah"".",83722,1800,2024-11-16 17:45:51,Text
This dad and daughter dancing on their walk🥹❤️,83708,600,2024-08-19 23:24:52,Text
Outside of Madison Square Garden in New York,83689,2749,2024-10-27 22:46:06,Text
Falling sick every other day,83673,426,2024-09-21 01:54:21,Text
My mom made a cake,83641,1880,2024-10-10 05:10:21,Text
No more waffles,83919,260,2024-11-19 12:55:11,Image
Pakistani reporter confronts man who tries to cover her hair with a scarf,83593,358,2024-04-24 03:30:14,Text
meirl,83598,1152,2024-09-08 09:51:24,Image
The Unknown Soldier,83542,2697,2024-08-12 01:36:17,Image
me_irl,83346,385,2024-07-06 10:57:36,Text
Pure genius,83498,612,2024-07-26 11:28:32,Text
It’s the laws that allow this that are the true crime.,83939,3332,2024-11-18 22:52:02,Image
Arnold Schwarzenegger terminates hate,83404,1347,2024-10-30 21:07:38,Text
Germans murdering a whole country,83407,5081,2024-11-08 12:48:40,Text
Lurking for a minute. 31m I live in a barn Still working on the bedroom & kitchen,83396,6314,2024-10-16 15:33:56,Text
Cameraman never dies.,83369,884,2024-04-27 14:53:40,Text
meirl,83343,1766,2024-09-25 03:15:03,Text
"Can’t say who but it’s definitely from Kendrick “Not Like Us” Some prominent middle aged staffer that grew up with hip hop said let’s just call him “weird” like Kendrick lol
Won’t try to prove it but the song is everywhere and in a lot cultural bubbles haha",83291,1064,2024-07-30 12:08:27,Text
She had a flashback,83262,205,2024-10-02 09:48:17,Text
"This flower is called ""Queen of the Night."" It blossoms only at night and only one night a year.",83165,1039,2024-08-17 03:42:31,Text
"In Brazil, this couple planted 2 million trees in 18 years TRUE HEROES",83144,554,2024-08-21 10:03:01,Text
Hope the guy is okay,83127,625,2024-01-06 13:24:04,Text
The king reigns.,83134,582,2024-01-29 05:14:26,Text
Factual!?!?!??,83116,283,2024-10-30 05:44:07,Image
What's the mood?,82980,6735,2024-11-05 17:03:43,Text
The first time a former president had be tried and found guilty on all counts,82969,4109,2024-05-30 21:12:31,Text
That's actually a crazy good idea,82965,53,2024-10-20 22:10:59,Text
Texas woman honors postal worker husband who lost his life due to extreme heat,82939,740,2024-09-30 09:52:00,Text
A young Elon Musk and his brother Kimbal Musk with their father's Rolls-Royce on their way to school,82940,4139,2024-10-15 14:57:21,Text
Hitting on wife in public,82897,902,2024-07-07 12:29:36,Text
My girlfriend met a person at the bar with the inverse of her tattoo,82931,3135,2024-07-25 14:51:10,Text
Maybe maybe maybe,82909,498,2024-10-15 02:40:54,Text
Fully accepted and welcomed,82895,1617,2024-06-22 17:49:51,Text
"Jeanne Louise Calment in her last years of life (from 111 to 122 years old). She was born in 1875 and died in 1997, being the oldest person ever whose age has been verified.",82905,2910,2024-08-17 00:38:48,Text
Eastern European human trafficker,82897,929,2024-11-16 06:17:16,Text
When Rudy Giuliani thought he was going to have sex with Maria Bakalova in the Borat sequel.,82888,1583,2024-11-04 01:02:30,Image
meirl,82895,2374,2024-02-26 20:15:28,Text
The Onion buys InfoWars website in bankruptcy auction,82866,1489,2024-11-14 14:08:18,Text
This is all unreal engine 5,82841,1184,2024-06-02 11:28:55,Text
Bob Ross son following in his fathers footsteps.,82703,638,2024-10-04 16:17:59,Text
Beans - this Fake Commercial (i made 10 years ago) is still the best idea i've had since 10 years :-),82666,1158,2024-08-27 10:56:37,Text
"Tim Walz - Chosen VP for Kamala Harris - ""I can't wait to debate JD Vance. That is, if he's willing to get off the couch and show up."" A rural American patriot with 24 years of service in the National Guard. A Highschool social studies teacher, a coach, small-town man.",82673,5983,2024-08-06 23:09:34,Text
"Cold-hearted ants leave a friend behind. This is a video with a powerful meaning:

Sometimes, those who lift others up are left waiting in the shadows of their own kindness. Not everyone will return the favor. In the end, the only ones you can truly rely on are yourself and the family who stand by you!",82653,2420,2024-08-17 13:38:47,Text
You never know whose day you could brighten,82646,299,2024-10-10 16:16:35,Text
Construction done right,82640,1585,2024-09-21 10:00:58,Text
"Clearly, he hates this.",82615,528,2024-11-14 18:45:48,Text
Fire fighter reacting quickly to save a child,82597,1522,2024-10-25 20:23:56,Text
Who doesn’t love natural mosquitoe population control?,82584,976,2024-08-15 16:32:35,Text
Tiger Shenanigans,82563,648,2024-09-01 00:33:24,Image
John McCain Saves ObamaCare with A Thumbs Down,82543,3494,2024-08-16 20:35:19,Text
me_irl,82529,532,2024-10-25 12:44:37,Text
This doesn’t Ad up,82526,1493,2024-09-21 02:11:38,Text
Average Trump supporter,82515,2784,2024-09-15 16:42:05,Text
🥹,82485,1059,2024-01-28 00:31:55,Text
Why Not Insulin?,82484,996,2024-09-15 12:05:32,Image
A love-hate-love relationship,82475,840,2024-06-29 13:58:41,Text
Who did it better?,82470,3176,2024-08-02 23:34:38,Text
"A 9,000 year old skeleton was found inside a cave in Cheddar, England, and nicknamed “Cheddar Man”. His DNA was tested and it was concluded that a living relative was teaching history about a 1/2 mile away, tracing back nearly 300 generations.",82241,1107,2024-09-28 15:44:16,Text
Meirl,82366,653,2024-08-18 04:09:50,Text
"Lightning Strike Hitting the Makkah Clock Tower Additional info on the [tower itself.](https://en.m.wikipedia.org/wiki/The_Clock_Towers)

Credits: [@al_hothali](https://www.instagram.com/al_hothaly?igsh=dHdibWE2MHVieG1u)",82315,1341,2024-08-24 21:48:19,Text
What life is like on a ship in the North Sea. I wouldn't last a day.,82316,2993,2024-01-22 19:28:53,Text
Tim Walz’s kids doing bunny ears behind him while he’s on national TV at the DNC,82336,991,2024-08-20 01:47:38,Text
"This old gal is 20, blind and still bad as ever",82334,635,2024-09-20 14:43:14,Text
meirl,82298,170,2024-10-20 19:04:05,Text
TIL The only plane permitted to fly on 9/11 after the attacks was a plane flying from San Diego to Miami to deliver anti-venom to a man bitten by a highly poisonous snake; it was escorted by two fighter jets,82286,2410,2024-09-10 04:49:22,Text
"My amazing sister beat bone marrow cancer! Despite the odds, my sister faced bone marrow cancer with unwavering strength and courage. She endured countless treatments, but her spirit never wavered. Against all expectations, she emerged victorious, defeating the disease. Her triumph is a testament to her resilience and an inspiration to us all.",82275,487,2024-09-03 05:34:58,Text
Wizardry,82201,503,2024-10-12 19:22:20,Text
"The man who lunged at a Las Vegas judge back in court, in front of the same judge",82116,5631,2024-01-08 19:36:22,Text
Right-winger Matt Walsh in disguise on the DNC floor,82199,7212,2024-08-21 01:36:35,Text
Sleeping Squirrels in their nest on someone's window ledge.,82185,311,2024-10-05 18:44:51,Text
That’s it. That’s all it takes. He will remember you for ever,82192,898,2024-11-04 02:38:14,Text
Testing the durability of a Toyota Hilux,82172,3882,2024-09-12 19:10:44,Text
"Former MMA fighter perfectly shuts down & chokes out a man who tries to attack him with a 14-inch machete 😳 Cool, calm & collected in such a risky situation. This would definitely require alot of guts to attempt!",82171,1767,2024-06-16 21:14:15,Text
A little girl taking pictures of her dad who had just graduated. It was just two of them,82146,423,2024-02-26 17:17:08,Text
2-days old and just finished her 10-hour open heart surgery,82142,2390,2024-03-02 06:20:40,Text
