Text,Score,Comments,Timestamp,Media_Type
The first time in 13 years I am not the first at my polling place. The polls aren't even open yet.,96288,2408,2024-11-05 11:30:36,Text
That is a good one,96214,890,2024-05-28 20:41:57,Text
"Ukrainian sniper, Vyacheslav Kovalskiy, broke the record for longest confirmed sniper kill at 12,468 feet. The bullet took 9 seconds to reach its target. The shot was made with a rifle known as ""Horizon's Lord.""",96258,2609,2024-09-10 17:40:15,Text
I can use his services,96246,614,2024-11-11 07:58:38,Text
George Bush flying over 9/11,96159,5538,2024-09-19 12:49:01,Image
go for it,96097,1474,2024-08-09 13:02:33,Text
Black queens are in shock,96039,784,2024-09-10 14:50:49,Text
A True Gentleman,95927,1724,2024-05-23 13:08:11,Text
"This guy used a laptop throughout a movie last night.  I was on the other side of the theater but noticed he was on one when I came in. 

It was a pretty big theater and I could see a faint light once the movie started but I kind of thought it was just an aisle light. 

When I went to leave I noticed he was still on it. Took this as the credits rolled. 

Note: he also had earbuds in but took them out right before the picture.",95906,4948,2024-11-08 12:38:08,Text
They could not figure out initially,95884,633,2024-07-18 08:53:36,Text
"Nyakim Gatwech is a South Sudanese model who is known as the Queen of the Dark because of her very dark skin, a result of high levels of melanin.",95797,651,2024-05-12 16:40:58,Text
She’s smelled it enough in her life already to distinguish it,95768,2220,2024-05-22 07:41:28,Text
How to roast.,95727,1083,2024-07-07 22:45:37,Text
A safety notice on an AH-1 Cobra Attack Helicopter,95746,2315,2024-08-18 12:55:31,Text
"In Don't Look Up (2021), Meryl Streep plays the president of the US. This acts as a reminder to the viewer that this movie is a work of fiction, given that the US would apparently prefer letting a convicted felon be president before a letting a woman in office.",95711,369,2024-11-06 10:38:44,Text
all time community note,95688,609,2024-10-18 18:50:22,Text
Kari Lake told to get off stage by teleprompter at Trump rally in Arizona,95624,1681,2024-08-24 03:18:13,Text
Topless is better,95618,299,2024-10-06 17:43:47,Text
A gang of Robber crabs invade a family picnic in Australia.,95568,6912,2024-04-15 19:43:31,Text
Video showing the shooter crawling into position while folks point him out to law enforcement at Trump rally,95536,9011,2024-07-15 02:20:10,Text
Truly deserved,95535,436,2024-11-17 20:55:02,Text
"Gave my 9 year old daughter my old DSLR camera last summer, and I am now only going through them.",95486,3596,2024-04-05 17:27:27,Text
This kid caught a Vulture thinking it was a chicken.,95463,2680,2024-09-22 00:04:14,Text
Comments?,95451,1068,2024-09-04 16:05:16,Text
President Biden standing in line to vote,95301,3009,2024-10-28 18:49:43,Text
"A staged propaganda photo of facist leader, Benito Mussolini ""harvesting"" wheat in 1938.",95346,3503,2024-10-21 23:43:10,Text
Met Tobey Maguire 10 years ago... but unfortunately my mom took the photo,95324,851,2024-03-27 00:19:51,Text
"Guy finds phone, actively looks for owner",95285,781,2024-06-16 14:09:15,Text
I found a rock that looks exactly like a piece of bread,95285,1366,2024-05-13 03:10:48,Text
This ad about negative assumptions and Down Syndrome,95275,3230,2024-03-15 01:00:44,Text
Fight fire with fire.,95191,630,2024-10-08 11:37:26,Image
Snoop Dogg carried the Olympic torch in Saint-Denis,95189,3328,2024-07-26 13:58:07,Text
Think about that,95088,3383,2024-06-08 20:07:46,Image
Eminem serving food to costumers at his Mom's Spaghetti restaurant,95067,2064,2024-06-28 15:57:07,Text
How many of ya'll knew slugs like beer?,95024,5031,2024-11-11 02:09:36,Text
Prison in Indiana accepts shelter cats and lets prisoners take care of them.,94995,1653,2024-11-04 20:39:59,Text
"I bought a bra, didn't notice this till I checked it at home..  The tag said massage feeling 🥲😅",94932,1609,2024-11-03 16:33:26,Image
Imagine busking on the street and the artist of the song you are singing randomly walks by...,94906,2292,2024-07-10 21:14:03,Text
Madlad Dad,94880,182,2024-09-05 19:13:43,Text
This guy is gradually increasing kinetic energy with elastic energy to avoid lifting a huge tire,94855,1068,2023-12-17 05:51:54,Text
In light of the documentary,94814,819,2024-11-17 15:25:07,Image
The cat better be getting paid for that,94793,753,2024-05-04 13:39:28,Text
"Guy who think leftists love Reagan, actually.",94762,3986,2024-10-21 15:29:54,Image
meirl,94740,626,2024-10-15 22:36:58,Text
"I fed this female box tortoise some raspberries at the beginning of the summer. Now, she follows me all over the garden, and visits me almost daily looking for handouts.",94662,1584,2024-06-25 19:04:52,Text
The real reason bikers wear full-face helmets!,94634,1391,2024-08-23 22:51:14,Text
"A 3 year old tadpole that didn't turn into a frog, banana on the side for scale",94649,1706,2024-09-13 09:26:02,Text
This is an uninterrupted minute of Maruay the rescued tiger with his beloved ball,94627,749,2024-07-22 13:30:36,Text
How is this possible...,94616,1699,2024-07-20 17:43:27,Image
The exact moment Kamala Harris realized she had found her campaign slogan,94592,8156,2024-08-13 20:32:49,Text
He's been waiting for this moment all his life.,94560,1179,2024-10-06 12:30:09,Text
Glitch in the Matrix,94534,1078,2024-06-07 11:49:55,Text
Real life Snoopy,94452,470,2024-10-24 12:48:42,Image
🔥Eddie Hall (former worlds strongest man) Vs Neffati brothers (tiktokers) goes exactly as expected 😂🔥 Commentator Sauce - Ozzy Man Reviews,94399,3215,2024-06-10 15:46:09,Text
"just witnessed a maybe once in a lifetime thing 🥹 so insane i witnessed this!! probably the most amazing thing ive ever seen in my life, the world is beautiful 🤍",94389,1399,2024-05-10 23:08:33,Text
Don't mess with people's food,94322,7137,2023-12-28 16:44:01,Text
tate,94272,3646,2024-01-10 17:36:11,Text
"25 male, a mailman, Japan I just started living alone and I wanted to share my rooms. Am I doing good?",94132,2127,2024-08-25 00:04:44,Text
Imagine How Much Harm They Do.,94165,1504,2024-07-18 18:40:01,Text
Madlad,94172,365,2024-08-21 09:41:54,Text
Sometimes we just need one more point of view,94118,324,2024-10-26 17:30:25,Image
The smiley face on my bag looks like he is barely holding it together.,94019,1065,2024-11-07 01:33:57,Text
Hotel workers try to hold doors shut hit by powerful gusts of wind from super typhoon in Vietnam,94015,3135,2024-09-09 09:12:32,Text
Madlad doing a family photo,93987,99,2024-11-05 21:32:54,Text
"Keep quiet, kid!",93898,955,2024-09-17 13:15:02,Text
"In 2004, Paul Walker secretly bought an $9,000 engagement ring for an Iraq veteran. Overhearing the couple in a jewelry store discussing their inability to afford it, Walker quietly paid for the ring and left. Source:

https://www.independent.co.uk/news/people/news/paul-walker-s-gift-actor-secretly-bought-iraq-war-veteran-engagement-ring-worth-9-000-8985815.html",93882,1101,2024-09-23 10:26:26,Text
Anyone use an ad blocking software?,93866,1033,2024-05-28 11:16:49,Text
"Muay Thai fighter, Lerdsila Chumpairtour, displays the top tier reflexes and reaction time that made him a world champion",95470,1417,2024-11-21 00:00:45,Text
"Believe what you see, not what you’re told.",93776,968,2024-04-23 13:33:06,Text
This seal could have gone his whole life not knowing lizards exist,93740,935,2024-09-06 18:41:36,Text
"my parents recording a video for future me, while they were still pregnant in 1999",93746,892,2024-09-17 03:51:32,Text
"TRAILER. (OC)  The simple life:
https://www.instagram.com/davecontra",93650,1699,2024-09-29 11:12:25,Text
"Guy photobombed his girlfriend for a month, by taking engagement ring pictures without her noticing",94221,950,2024-11-19 11:34:27,Text
Biden poses with kids wearing Trump T-shirts in Pennsylvania,93563,11965,2024-09-12 10:46:03,Text
Found a $20 with a nice serial number,93543,1982,2024-05-08 20:36:15,Text
A poster hanging in this counselling room,93531,6961,2024-08-28 13:20:22,Text
Meirl,94737,524,2024-11-20 14:43:27,Text
Well..,93470,2415,2024-08-26 19:35:26,Image
Meirl,93396,366,2024-11-05 14:10:30,Text
Principle goes out of his way to give a students mom her dying wish to see her son graduate,93368,737,2024-11-12 17:24:58,Text
My wife and I painted a mural in our baby’s nursery,93348,2502,2024-08-22 14:58:40,Text
Pulling an invisible wire,93292,949,2024-09-03 07:41:28,Text
"I got a point off for stapling my homework wrong  This was just for a daily homework assignment that was worth like 5 points… not an exam or paper or anything. 

College is weird.",93715,2552,2024-11-18 19:26:49,Text
A camera-less iPhone issued to my buddy that works at a Nuclear Plant. No cameras allowed.,93235,1956,2024-06-16 12:59:23,Text
Meirl,93175,3358,2024-10-26 19:19:21,Text
This photo my kid’s daycare sent us of him helping them bake a cake.,93159,733,2024-09-24 14:19:52,Text
"A man was discovered to be unknowingly missing 90% of his brain, yet he was living a normal life.",93152,7006,2024-08-19 13:22:25,Text
"Climate change is an issue, Mr Clarkson",93056,2394,2024-07-22 21:26:26,Text
Same clothes for six months,93033,567,2024-08-26 13:44:30,Text
I'm almost certain this has to be Jason,93027,483,2024-09-02 11:45:27,Image
Firefighters being bros,93009,339,2024-08-18 21:14:23,Text
Blursed_Keychain,93008,652,2024-07-14 09:52:32,Text
Eating sugar statues,92983,4416,2024-10-08 09:43:49,Text
A wholesome Olympic moment  Respect to the German team👏 great that the athlete had such fast support,92982,872,2024-08-09 14:47:13,Text
The technique used by silver winning Olympic shooter Yusuf Dikec is suboptimal for Olympics.,92963,2139,2024-08-01 19:19:57,Text
"Closed expressway for a donated organ to arrive in time. In 1st of October on Rio de Janeiro, Brazil the police temporarily closed one of the busiest expressway (Linha Vermelha) so a liver could arrive in time to a 69 years old patient who waited for 3 months.

This usually is made by helicopter but the hospital where she was didn't have an appropriate place to land.",92913,966,2024-10-31 10:02:30,Text
meirl,92854,711,2024-10-30 01:56:17,Text
The Family Matter,92881,1116,2024-08-22 17:02:45,Text
We could use more judges like this in America,92819,4787,2024-10-10 11:30:59,Text
"TIL legendary session bassist Leland Sklar put a switch on his bass that does nothing. He calls it the ""producer switch"" — when a producer asks for a different sound, he flips the switch (making sure the producer can see), and carries on. He says this placebo has saved him a lot of grief.",92737,1039,2024-10-28 19:28:15,Text
meirl,92846,731,2024-06-12 09:31:00,Text
Got called out by my teacher because the essay I wrote was flagging as AI Wrote a report on my marketing and she checks on a AI detector and the essay I wrote is flagging as AI... What kind of a world do we live in,92766,6259,2024-08-06 18:33:41,Text
Meirl,92687,9536,2024-08-28 16:53:03,Image
"A boy at a museum in Haifa today broke a 3500 years old jar.  the incident took place at the Hecht museum inhaifa, Israel.",92671,391,2024-08-23 17:34:08,Text
"TIL that when “Fight Club” premiered at the 1999 Venice Film Festival, it got booed hard by the audience. Ed Norton said that as it was happening, Brad Pitt turned to him and said: “That’s the best movie I’m ever going to be in.”",92660,3235,2024-09-17 23:38:28,Text
Indian food.,92644,2939,2024-11-02 17:03:32,Text
The whole family is messed up.,92576,1493,2024-09-15 10:53:42,Text
Father jumps on unconscious son to save him from being gored by a bull,92549,3768,2024-11-04 12:20:26,Text
Democrats come to terms with unexpected election results,92541,21349,2024-11-06 07:16:56,Text
"Update on the depression den: progress, not perfection",92511,1418,2024-08-27 01:15:08,Text
We will love it,92454,6976,2024-08-31 09:28:13,Text
"Scratches from fighting would-be rapist, several days healed",92440,5049,2024-08-02 15:35:47,Text
"By digging such pits, people in Arusha, Tanzania, have managed to transform a desert area into a grassland",92349,1423,2024-08-28 04:32:53,Text
The reflection in this DVD.,92258,316,2024-10-10 11:24:05,Image
This was the best ten minutes in the history of television,92188,1867,2024-09-22 19:51:35,Text
Paul Alexander (78) dies after being in an iron lung for 70 years after a Polio infection,92171,2574,2024-03-13 11:05:27,Text
What a sad country we live in for my 12 year old to text me this:,92110,5649,2024-09-12 13:52:53,Text
A young woman with cancer recorded her recovery process and the amazing result,92050,1164,2024-03-03 18:24:56,Text
"Canadian photographer Francois Brunell searches and photographs similar people, but who are not related to each other. He has currently done about 200 couple portraits. Francois finds his models as he travels the world and then invites two complete strangers to a photoshoot.",92001,2621,2024-05-02 18:09:55,Text
My wife and cat have been prescribed the same meds,91956,5549,2024-07-26 14:09:56,Text
There is a difference between the two,91901,492,2024-11-12 13:28:28,Text
This Spider built a web on my bug trap. The light attracts insects.,91876,1598,2024-09-11 18:25:25,Text
Husband and Wife Tara Davis-Woodhall & Hunter Woodhall are now both Olympic and Paralympic Gold Medalists,91864,398,2024-09-06 18:47:49,Text
This barber giving makeovers for women,93589,2190,2024-11-20 07:54:06,Text
"From the Time I Was 8 Years Old, I Wanted to Be an Author. I'm 56 and I Published My First Book With a Major Publisher, and It's Been Optioned for a Hallmark Movie.",91786,1786,2024-11-13 18:31:34,Text
Fluffy round paws,91728,346,2024-11-09 19:35:29,Image
Running late and missing your cruise ship,91700,1437,2024-09-11 01:39:43,Text
Took my kitchen knives to be sharpened and they gave me a band-aid with my receipt,91683,726,2024-10-02 17:31:35,Image
Two dogs digging a hole got busted by the owner.,91677,915,2024-07-18 11:49:22,Image
"Best Buddies At 10, 17 And 29 Years Old",91668,1531,2024-06-02 13:13:47,Text
Bark at your dogs to see their reaction.,91660,1959,2024-08-14 00:01:19,Text
i'm 19 and have never cooked anything in my life. this is my first attempt at a balanced meal in my college apartment,91597,3958,2024-10-03 21:59:41,Text
"My neighbor idles his diesel truck for an hour every morning and fills my apartment with exhaust fumes. He knows he's doing it and told me to 'man up' My windows and doors don't keep it out when closed, i opened the door just to take a short video but we've been waking up with headaches and nausea and the smell lingers for hours",91559,16115,2024-10-28 13:52:27,Text
Meirl,91611,388,2024-11-14 02:10:07,Text
"Guy trips down stares, hits fire alarm",91602,7189,2024-03-15 19:10:03,Text
"Phone dead, about to explode",91580,10049,2024-04-05 00:04:36,Text
Firefighters’ Union Members wearing “Trump is a scab” shirts welcoming JD Vance today.,91544,2433,2024-08-30 00:10:06,Text
"This is a real, unaltered picture taken by photographer Keinichi Ohno",91463,505,2024-11-01 19:34:07,Text
"Third Man Syndrome is a bizarre unseen presence reported by hundreds of mountain climbers and explorers during survival situations that talks to the victim, gives practical advice and encouragement.",91453,3417,2024-09-24 08:58:20,Text
One Game Hunting,91444,1448,2024-10-13 06:22:31,Text
"I bought a house and this guy ran inside immediately. Apparently the elderly woman who lived here had him, so I guess I have a cat now?? The neighbours have been looking after him from what I gather, but he stays strictly outside. I’m going to speak with them and see what happens from there. 


He sleeps in my garden all day and spent the first three days trying to get in the house before a friend filled me in on who he is. 


When I finally let him in he bolted to the master bedroom and purred loudly in there for like 10 minutes 😿😻",91440,2300,2024-08-28 22:34:15,Text
"I had a student hit a new low the other day. I am now fearful the next generation will be the death of me. For context, I am a professor of communication located somewhere in the United States. Pray this did not happen at a college near you.

Usually, I can take a lot of things in stride. When it comes to students, I would like to think that I can handle practically anything. Teaching at an institution where many students are first-generation college attendees will always bring unique challenges. I realize that many do not have much life experience to work with, nor have they traveled to different places. I must keep it in mind as I work with them daily. If I didn’t do that, I would probably snap,

One student recently pushed me to the limit of my stupidity tolerance. I knew I was in for a long semester when she openly admitted during the first week of class that she was only in college to earn her MRS. It was the first time I ever heard this spoken aloud. For the sake of this story, I will now call her Ms. Manhunter. She was looking for a husband to marry who would take care of her. Our school has exceptional law and medical schools, so I think she was haunting those halls hoping to find Mr. Right-Now. 

However, I knew Ms. Manhunter would be a handful for whomever she was with when she dropped a little nugget of knowledge that floored me. Her words still haunt me, and I am considering chiseling her quote on my grave marker so that it will never vanish into the ether of history. I tasked Ms. Manhunter’s class with formulating a persuasive speech. I let students work in groups because I figured they should pitch their ideas to the people who would hear what they presented. I walked around the room, giving points to consider as they concocted their ideas. When I arrived at the group with little Ms. Manhunter, a student proposed that we should colonize the moon. This topic sounds like a great speech, but I must interject my sarcastic two cents. I mentioned that I believed we should blow the moon up, just like Alexander Abian proposed in the 1990s.

The student I was talking to understood that I was joking. However, Ms. Manhunter did not grasp that my reply was dripping with sarcasm. She promptly replied without hesitation that **if we blew up the moon, there would no longer be night**. The moment those words hit my ear, everything stopped. The little hamster in my brain decided it was time to go on vacation because I couldn't formulate a sentence responding to her blithering lunacy. Thankfully, the first student recognized that I was having problems and tried her best to explain to Ms. Manhunter how night and day worked. Even with the explanation, **she still insisted that the moon brings nighttime like the sun brings daylight**. I do not drink, but this was one moment in my life when I seriously considered taking up the habit.",91372,5963,2024-09-04 14:01:59,Text
VelociRyan,91353,247,2024-10-13 12:53:02,Image
Traditional marriage is between one extremely online poster and one well adjusted normie.,91318,1098,2024-09-18 00:26:41,Text
What happens when you inject sodium and potassium into an apple,91283,2038,2024-06-01 23:31:47,Text
Meirl,91255,830,2024-11-11 09:29:00,Text
Bro won at life. Best marriage proposal reaction ever,91254,1050,2024-10-20 18:25:02,Text
"Dawid Godziek, the 2024 Slopestyle World Champion, riding his bike on a moving train. A world-first feat",91194,1510,2024-09-12 15:50:46,Text
When illusion overcomes the brain.,91188,1503,2024-05-11 13:23:15,Text
"Taishan in China: There are 7,200 steps, and it takes 4 to 6 hours to reach the top.",91098,4134,2024-04-18 14:58:57,Text
Bro took “Remain calm and inform an adult” to next level..,91090,1607,2024-05-22 10:38:42,Text
The lady lawyer is right,91061,2704,2024-08-17 20:36:18,Text
The moment they found out when she was pregnant ☺️,91058,3149,2024-08-21 10:54:16,Text
Meirl,91014,1502,2024-06-03 18:25:56,Text
117 degrees in Arizona today.. Melted the blinds in my house..,90982,3059,2024-07-06 23:37:00,Text
Freshly fallen snow next to a lake,90970,371,2024-10-22 11:53:33,Image
"In Gladiator 2 (2024), Pedro Pascal wears a black and blue outfit.",90911,830,2024-10-27 20:57:39,Image
Young Woman spots cancerous mole on this coach's neck in the middle of this hockey game.,90901,827,2024-09-04 15:01:58,Text
I'd be all in too,90887,285,2024-11-05 12:27:35,Text
Hahha. Imagine that,90845,604,2024-09-12 10:09:05,Text
Warning on Fascism,90838,4658,2024-10-23 21:50:50,Text
A hairdresser in Barcelona made his customers wear Real Madrid jersey aprons.,90821,1003,2024-11-02 06:03:11,Text
Couldn’t you just have.. printed the hours.. on here,90806,2682,2024-10-31 01:33:14,Text
Meirl,91079,1699,2024-11-19 03:39:40,Text
Girl with the pearl earring,90785,784,2024-10-18 18:03:55,Text
My child that was born last week has natural blonde highlights.,90736,2084,2024-07-21 22:48:14,Text
Me_irl,91425,757,2024-11-19 16:17:36,Image
Found this Giant amethyst at a garage sale for 50 bucks the dude had no cell phone or computer and said his Uncle mined it 10 years ago. I asked him if he had any vintage clothing and he came out with this. Looks like something out of a movie.,90586,2848,2024-10-11 21:29:21,Text
Payment for work? That’s socialism!,90633,772,2024-09-29 12:34:10,Image
Like a boss 🤌,90636,176,2024-11-13 06:46:59,Text
Thanks for being accessible,90547,872,2024-08-21 18:51:26,Text
Take a second look,90416,2159,2024-09-28 02:24:09,Text
When we say bird brain this is what we mean,90532,1164,2024-11-09 02:38:44,Text
Absolute madlad,90519,255,2024-11-14 21:08:55,Text
meirl,90447,424,2024-09-18 18:38:33,Text
The crowd currently at the Ellipse for the Kamala Harris rally,90345,2792,2024-10-29 23:28:33,Text
Kind Man Leaves Ice Water For The Foxes,90370,578,2024-08-16 13:21:03,Text
Verizon sales rep told me to show up hours early if I wanted to get the new iPhone on Day 1. This is 15 minutes before they opened.,90352,4294,2024-09-21 12:20:10,Text
Epstein Maxxing 🏎️,90320,1793,2024-06-30 01:34:25,Text
"This man, Michael Smith, used AI to create a fake music band and used bots to inflate streaming numbers. He earned more than $10 million in royalties.",90268,3581,2024-09-10 10:30:02,Text
"Elon Musk shaking hands with Donald Trump at his rally in Butler, Pennsylvania",90209,10858,2024-10-06 01:46:34,Text
Oddly specific 27 year old brother,90121,577,2024-10-17 00:57:15,Text
This mother who visits her son on his first job,90089,1018,2024-08-18 21:29:39,Text
A true man of the people,90007,1891,2024-10-01 14:51:42,Text
"Left for 10 minutes, 6 year old cousin decided to help",89978,1187,2024-11-04 05:19:15,Text
"Box lunch from sandwich shop comes with picture of a cookie, rather than an actual cookie.",89879,2197,2024-06-19 17:19:12,Text
"Never, Never give up guys",89789,2450,2024-06-07 16:42:18,Text
Wonder where it was hidden,91053,170,2024-11-19 21:35:03,Image
"Y'all, I think she broke him",89754,3089,2024-09-11 13:40:00,Text
First appearance of Gov. Tim Walz with presidential candidate Kamala Harris as her running mate,89752,4835,2024-08-06 22:00:29,Text
The Canadian Naval Diving Academy celebrates graduation by taking their class picture underwater,89696,909,2024-03-05 14:12:02,Image
