Text,Score,Comments,Timestamp,Media_Type
"South Korea sent a fully-kitted out player for the Olympic shooting. 
Turkey sent an 51 yr old guy with no specialized lenses, eye cover or ear protection and got the silver medal",272347,6226,2024-07-31 19:08:11,Image
Door man saves woman's life,255699,11415,2024-11-01 16:24:14,Text
"I broke the rules and took something from an abandoned church No chip, no collar and love at first sight.",207876,3602,2024-06-27 17:19:35,Text
"This is not Germany 1930s, this is Ohio 2024.",198938,32099,2024-11-17 19:33:05,Text
Bro got both eyes open 😭,194912,3087,2024-07-31 21:50:19,Text
Tony Hawk meeting his grandson for the first time,194856,2266,2024-09-30 22:14:21,Text
My micro-premie daughter reaching out to me from the NICU. It’s tough man…,191564,4833,2024-09-23 03:17:58,Text
I visited Moo Deng today,186343,1810,2024-10-03 02:51:24,Text
"Its not just a phase, MOM.",181964,1777,2024-09-12 23:15:07,Image
The woman I’m dating gave me onions and tomatoes from her garden.,181669,3384,2024-10-19 23:17:06,Text
Messi’s bodyguard,180407,3766,2024-07-06 21:14:53,Text
"A dog was running after the ambulance that was taking his human. When the EMS realized it, he was let in.",179711,1683,2024-09-12 11:56:15,Text
It was all STAGED!! Trump did not work. McDonald’s closed for the day & there was a car rehearsal.,178184,16252,2024-10-20 20:31:29,Text
Meirl,176060,1349,2024-10-25 14:41:59,Text
Rapper Eminem is set to become a grandfather.,175547,3019,2024-10-03 17:17:15,Text
"Spotted in Irving,TX",174239,3764,2024-10-30 15:47:16,Text
Couple moves out of the way for a photo,173456,454,2024-10-29 01:36:07,Text
Spinning a stick,173329,2875,2024-11-05 11:03:26,Text
"New Zealand's parliament was brought to a temporary halt by MPs performing a haka, amid anger over a controversial bill seeking to reinterpret the country's founding treaty with Māori people.",171396,260,2024-11-14 17:01:32,Text
Engineering student decided to receive his degree with ceremonial indigenous attire.,171239,2551,2024-11-10 22:56:45,Text
Mom burnt 13-year-old daughter's rapist alive after he taunted her while out of prison,170677,11722,2024-08-01 19:29:38,Text
I’ve felt a void in my life ever since my cat passed so I adopted the saddest cat at the shelter,169355,1580,2024-10-01 16:06:35,Text
Hot wheels losing details over the years,168236,3225,2024-11-12 14:32:06,Text
I'm an intern at my local library and I'm proud of my job,168071,2001,2024-09-01 14:44:25,Text
Trump's head movement during the shooting was incredibly lucky,166626,16996,2024-07-16 19:21:32,Text
"I was banned and muted from an art subreddit for packaging my 3D printed work, so I printed and packaged the mod.",159798,2405,2024-09-11 13:37:50,Image
Donald Trump found guilty on all 34 counts of falsifying business records.,159137,11516,2024-05-30 21:13:02,Text
I can't stop smiling. I just kicked Cancer's ass.,157148,1742,2024-09-08 16:22:23,Text
"Today, after 841 days of treatments, my son rang the bell. He is now 100% cancer free!!",156161,2117,2024-02-22 20:03:08,Text
A WOMAN SPENT 27 YEARS PHOTOGRAPHING HER PARENTS WAVING HER GOODBYE,154757,4192,2024-11-11 13:58:28,Text
LMAO,153521,896,2024-10-07 00:52:05,Image
Bro used a carpet instead of a wingsuit to BASE jump,152552,3790,2024-08-20 18:11:41,Text
Lady misses Justin Timberlake singing to her while she’s texting,150247,6882,2024-10-06 16:32:54,Text
Trump says illegal immigrants are “eating the dogs…they’re eating the cats”,149813,6782,2024-09-11 01:43:13,Text
"My elderly mother doesn't want to move, she is now surrounded by new townhouses in all directions.",149003,5065,2024-05-07 01:34:08,Text
Kid wants to know if his mum is telling the truth and Reddit doesn’t let her down.,148705,788,2024-10-20 21:22:28,Text
Office life before the invention of AutoCAD and other drafting softwares,148155,3672,2024-10-25 09:45:07,Text
Trump’s Vice President says Trump should never be president again.,147507,4831,2024-07-29 06:11:43,Text
The helmet Trump received vs the helmet Obama received after the Patriots won the Super Bowl.,147281,2708,2024-10-27 20:02:39,Text
"In 2016, a guy hijacked an Egyptian airline with explosives packed to him. A British man on board asked for a picture with the hijacker as it was happening",146339,2034,2024-11-05 00:46:59,Text
Hillary Clinton and Kamala Harris after the 2024 election results,145556,18951,2024-11-07 18:09:14,Text
I asked my friend if he got his raise. He sent this.,145461,1324,2024-08-24 21:26:54,Text
"Drone pics of North Korea, I was in China, my drone flew across the border",144591,6870,2024-03-26 16:15:32,Text
Ok now this is Halloween 🎃,144380,663,2024-10-28 01:41:38,Text
This man 💯,144328,533,2024-09-22 13:43:19,Image
Surfing instructor save,143488,1607,2024-09-02 21:09:35,Text
My latest drawing,142965,3101,2024-10-07 15:06:33,Image
Neighbors like this are far and few between,142845,2674,2024-08-19 21:00:41,Text
"Bernie Sanders, gently pushing the pillow in the Democratic Party's face",142132,8435,2024-11-06 23:59:14,Image
"Jack Black walking around Brighton, England alone.",141849,2720,2024-05-16 22:01:35,Text
"The moon : same time, same place, 28 days.",141285,672,2024-09-02 13:47:31,Text
Podcaster Andrew Schultz  laughs in Trump's face when ex-president calls himself 'a truthful person',140157,4700,2024-10-09 18:32:51,Text
Protect him at all costs,140142,472,2024-11-07 17:43:10,Image
Never underestimate your opponent,139663,2617,2024-10-28 17:44:38,Text
Light switches indicating what they switch on,139459,968,2024-10-26 07:40:02,Image
"Not a Mass resident, but really liked this comparison",139321,14261,2024-11-16 04:04:40,Text
"Exactly 10 years ago I went to North Korea. You can't go there now, but it looked like this.",138298,5352,2024-03-24 13:55:58,Text
California store prices items at $951sp shoplifters can be charged with grand theft,137689,4076,2024-10-28 18:09:09,Image
I grew my hair out for 3.5 years to turn into a wig for my gf with alopecia,137628,1908,2024-03-08 16:17:39,Text
"The first photo taken of the Titan submersible on the ocean floor, after the implosion.",137525,5623,2024-09-16 19:29:13,Text
Son’s math test,137172,14028,2024-11-13 03:19:21,Text
"In 2015, a paramedic captured a photo of a doctor crying outside after losing a 19-year-old patient.",136331,1801,2024-09-28 03:48:17,Image
"Cleaning my depression flat after months of being in a bad place 

Hi,

I just wanted to share my before and after of my living room & kitchen.. mostly because I'm proud but also because when I was trying to start this, I couldn't find much on the internet & that made me feel worse. 

This is a build up of being depressed for months, if not years, just scraping by. So please, no judgement. Eventually it got to the point there was just no more space to do anything, couldn't cook or have a space to relax and it made my depression worse.. I took a week off work & this is what I managed. There's still the bedroom, but I'm waiting on my new bed & drawers being delivered. Then next is the second bedroom which is piled high with just junk and rubbish, it's overwhelming, so taking a few days to recoup then I'll start there. Tips welcome!",136031,5762,2024-07-30 12:36:24,Text
Dinner date,135888,3854,2024-10-24 13:19:23,Text
He Is Honest. The Best Kind Of Doctor.,135758,1317,2024-07-11 17:05:31,Text
Footage of woman's head literally steaming from menopause.,135517,4383,2024-11-01 23:07:12,Text
Hurricane Milton,135109,13146,2024-10-08 01:05:02,Image
I competed in the Paralympics in winter 2006. But my life‘s work didn’t truly begin until Halloween 2010.,134951,1548,2024-10-31 15:10:06,Text
Paul Rudd handing out waterbottles to students waiting in line to vote,134955,1831,2024-11-05 21:34:57,Text
Well she did mention having it.,134856,214,2024-09-20 23:29:18,Text
Meirl,134787,643,2024-11-01 17:17:53,Text
Climbers ascend to the highest peak of Poland and find a cat at the summit,134758,1193,2024-08-22 05:33:15,Text
"President Biden hugging his son, Hunter, after he was convicted. Joe promised not to pardon him.",134705,12265,2024-06-11 21:33:13,Text
EXTREMELY RARE PIEBALD MOOSE SPOTTED IN MAN'S BACKYARD IN NORWAY,134122,877,2024-10-20 04:36:58,Text
People who actually care. They are everything. 😊,133824,886,2024-09-27 10:49:00,Text
I clipped a baby bunny's ear with my mower 2 years ago. Same bunny spotted today.,133550,1434,2024-06-29 00:43:26,Text
A fish jumps out in a perfect shot timing,133536,1104,2024-09-09 00:57:25,Text
"A tram just derailed and crashed into an Apple Store in Oslo, Norway",133326,5108,2024-10-29 11:41:35,Text
My gf captured the exact moment the lights changed colour at the concert,133214,428,2024-10-27 00:38:59,Text
that was the softest shedding I've seen.,132923,1255,2024-09-24 01:19:16,Text
"Mike Pence Commits Career Suicide By Refusing To Overthrow US Govt, 01/06/21",132505,5194,2024-08-02 20:20:02,Text
Unusual encounter on a beach in Australia with an emperor penguin that is endemic to Antarctica,132156,3595,2024-11-15 18:46:16,Text
When I was young I numbered each dimple of a golf ball,131541,2583,2024-10-27 00:58:19,Text
Infertile Tawny Owl's lifeless eggs are replaced with orphaned chicks while Tawny Owl is away,131454,1435,2024-08-31 05:39:03,Text
I like this guy's style,131404,2098,2024-10-11 15:57:37,Text
This pic comes from Indiana,131371,3312,2024-09-17 14:45:15,Text
Young skater never gives up trying to pull off a sick trick,130777,1562,2024-08-18 23:29:05,Text
He secretly learned Chinese to propose in her native language,130565,2576,2024-08-07 15:17:58,Text
Kid dressed up as a Chinese dragon meets some grown up dragons,130217,553,2024-11-16 04:15:39,Text
"""Wait, that wasn't the same movie?""",130081,760,2024-09-24 15:51:53,Text
My wife just out of the shower checking email,130072,878,2024-03-10 15:35:36,Text
My Aunt turned 100 today!,130021,5437,2024-10-01 02:11:44,Text
What the actual fuck.,129874,1778,2024-09-03 16:55:56,Text
meirl,129593,1448,2024-08-17 12:17:55,Text
Tim Walz after he signed a bill providing free breakfast and lunch to Minnesota students,129594,4108,2024-08-06 13:54:30,Text
I'll just leave this here... and see what happens.,129346,20037,2024-11-07 12:49:43,Image
She regularly greets her husband at the door after work.,129168,4447,2024-05-08 09:45:51,Text
My prize winning carrot from this year’s harvest,128877,1130,2024-09-29 02:57:22,Text
I feel the anger through the screen,128746,2787,2024-09-22 15:36:05,Text
This is the clearest photo ever taken of Venus,128682,786,2024-11-06 20:12:01,Text
"I brought muffins to work because of my birthday, 5 minutes later they told me i am fired because of budget cuts.. I feel like an idiot, i’m already poor and this job was a bit of light in a dark cave.

still let them keep the muffins though :/",128615,3684,2024-07-26 12:14:05,Text
"(OC) Overweight since childhood - no energy, no motivation, and a growing pile of health issues until I decided to make a change  Hey everyone!

I’ll give a background for anyone interested and a TLDR at the bottom

When I was 12 years old I was already over 200 pounds - the fattest kid in the class / among his social group. I’ve been huge since my youngest memories 

By the time my 23rd birthday was coming up I was nearly 300 pounds and the health issues were overwhelming- terrible back pain, 
no energy, no motivation, brutal brain fog, my mobility was going away as the weight increased. People were constantly telling me I looked over 40 years old

I knew I shouldn’t be feeling so shitty at such a young age and decided there was no way I could continue down this path 

I woke up October 20, 2021 looked into the mirror and told myself today is the day I start and never go back

By August 2022 I lost over 100 pounds

Since then I’ve continued to maintain the weight loss while working on adding muscle - it’s been 2 years since I “finished” and I have not gained back any substantial weight / fat besides muscle

I started with a calorie deficit and exercise routine I developed that focused on minimizing loose skin by retaining as much muscle as possible 

No fad diets, no cutting out sugars or foods, no surgeries, no weird miracle products or any BS. Just a calorie deficit and solid routine / nutrition



TLDR

Lost over 100+ pounds naturally through calorie deficit and exercise",128504,2927,2024-08-30 16:13:35,Text
Japnese kids doing their assignment,128354,1008,2024-06-14 04:28:29,Text
Meirl,128319,1667,2024-09-14 12:11:08,Image
Claudia Sheinbaum becomes Mexico's first ever female president.,128208,4826,2024-06-03 12:02:56,Text
Korean women's pistol shooter Kim Ye-ji casually breaking a world record and winning gold,127575,2972,2024-07-30 06:14:54,Text
"My 16 yo stepdaughter changed her last name to mine on Father’s Day. On her own, with her own money.",127538,2096,2024-06-19 08:01:12,Text
My “Going Away” cake from my last day at work at an IT company.,127500,279,2024-10-26 23:35:24,Text
"Our State’s Finest We swore in our newest gaggle of lawyers today. As usual, the state did us proud.",126983,4895,2024-10-22 23:16:20,Text
Summoning Grandmas,126964,1148,2024-07-18 10:20:11,Text
A 74-year-old man in Florida pulled his puppy out of an alligator's mouth.,126474,4778,2024-11-08 14:47:20,Text
Mosquito coil holder made using a 3D printing pen.,126467,963,2024-06-30 19:18:25,Text
"Putting my childhood cat to sleep today, and did my best to recreate a 20 year old picture. I will always love you Gandalf.",126409,1930,2024-05-03 19:17:56,Image
Proud dog in Brazil posing in front of his seized cocaine haul,125951,1636,2024-10-16 15:08:40,Text
Magic 69,125553,1483,2024-10-29 04:47:10,Text
Are you a convicted felon?,125551,3616,2024-07-06 17:32:07,Text
South Korean Olympian takes a selfie with North Korean athletes.,124889,2359,2024-07-31 05:34:46,Text
Residents of Springfield are flooding Haitian owned restaurants to show their support  Show,124810,2177,2024-09-15 01:25:58,Text
"I cancelled my dinner date because I was 99% sure THIS was happening tonight! This lil guy has been somewhat neglected. We've recently moved house and I am gradually repotting all my spiky guys on my days off. Once he finishes flowering he's gonna get some overdue love! ELEVEN blooms, with another 8+ just starting to form. Puts on such a good show. I've been outside every hour checking on them 😅
Excuse my poor photography... night lighting is hard.",124664,1260,2024-11-02 11:47:42,Text
Why do men feel the need to go through things alone?,124594,7262,2024-05-15 17:35:08,Text
"I turned 26 today, which means I’ve lived to see 23 more birthdays than I was expected to see. Cheers!",124039,3027,2024-02-27 23:34:33,Text
"Tomorrow, Jimmy Carter will turn 100, marking him as the first US President in history to make it to his 100th birthday!",123374,1546,2024-09-30 21:58:40,Text
Smell Test,123384,4517,2024-11-12 01:22:37,Text
Her friend got stuck in a Hawaiian bathroom and a kind man saved the day,123222,3485,2024-09-03 23:25:42,Text
Tony Hawk dressed as Larry David for Halloween.,123105,414,2024-10-24 15:55:05,Text
Tim Walz ordering a pizza with his wife after the debate in New York City,123046,3404,2024-10-02 03:59:15,Text
The burnout is real,123009,1204,2024-09-03 17:37:14,Text
Off-duty cop passes shoplifter,122924,2034,2024-07-12 08:38:11,Text
Former President Trump after the presidential debate.,122734,9303,2024-09-11 06:32:40,Text
This Golden Retriever followed a Google Map Snapper and appeared in over 1000 photos,122576,461,2024-10-25 00:38:23,Text
meirl,122520,650,2024-11-11 00:21:28,Text
New Zealand's 1news prime-time anchor Oriini Kaipara wears a traditional face tattoo for Māori women.,122504,2817,2024-07-26 22:22:24,Text
Aubrey Plaza just endorsed Kamala Harris and Tim Walz while sharing this photo,122361,1963,2024-09-11 17:18:08,Text
It is just you,122315,1807,2024-11-17 14:10:39,Text
Keanu Reeves placed 25th out of 35 in his professional racing debut at the Toyota GR Cup,122031,1594,2024-10-06 14:35:58,Text
Guy in Scotland continuously flying the flag of whoever's playing against England in the Euros,121936,2717,2024-07-07 13:16:54,Text
Meirl,121768,1959,2024-08-20 11:19:48,Text
Me_irl,121688,2986,2024-10-09 10:38:36,Text
"Windshield Note.  To the man who left this thoughtful note on my windshield at Lower Pines Campground this weekend, I extend my heartfelt gratitude; your acknowledgment of my efforts to be a good father means a great deal to me.",121465,537,2024-09-23 06:25:56,Text
A man shows his commute to work in Chongqing.,121250,2456,2024-10-11 09:48:23,Text
"Trafficked woman found her parents after 26 years, who died from depression shortly after losing her",121122,2140,2024-10-12 17:44:21,Text
Water Fire Shield Training,121502,1387,2024-11-19 10:28:34,Text
EMT's showing a patient the ocean before they go to hospice care.,120625,753,2024-10-04 19:15:36,Text
This guy found himself on an empty airplane and took a picture in every seat and photoshopped it together.,120635,516,2024-11-01 02:37:09,Text
The celebration is unmatched,120566,2406,2024-11-10 03:07:01,Text
A woman gave a hungry fox food and he came back with friends,120455,2257,2024-10-05 15:48:44,Text
Told the seller I was missing the CTRL key and he sent me this.,120082,1597,2024-11-02 22:16:44,Text
Not again,119964,508,2024-10-17 23:09:00,Text
Grandma broke her nose hiking and didn't want the helivac. She won $450k lawsuit,120386,5450,2024-11-18 06:11:38,Text
me_irl,119923,904,2024-08-30 08:41:59,Text
This sign my father in law just put in his front yard.,119779,2408,2024-08-28 16:13:19,Text
"I've been losing weight since last October, down nearly 90lbs! Started the dieting in October, started working out 2-3 days a week in March (I love weight training!) And currently doing a 30 day challenge to visit the gym every day, 14 days so far! My back doesn't hurt as much, I'm sleeping better, and I can walk up stairs without getting winded lol. I still have a long way to go, but these results are encouraging",119466,2048,2024-08-24 18:32:50,Text
"Remember, we punch fascists here",119433,2167,2024-11-14 00:14:12,Text
Parents watching their kid take his first steps,119261,1188,2024-01-04 09:01:09,Text
10 years ago today… Exactly ten years ago today a little moment of madness in our kitchen became an internet meme,119173,1209,2024-10-05 07:42:28,Text
Uninspiring teacher comment My 11 year old daughters teacher wrote this comment on her homework. I'm absolutely flabbergasted and angry. This after my daughter just competed in gymnastics nationals a month ago.,119092,10885,2024-11-15 11:26:01,Text
Eminem and Barrack Obama in Detroit.,119045,2540,2024-10-23 00:28:43,Text
Smoking gun...,119011,4011,2024-07-03 19:06:16,Text
Made me smile,118853,632,2024-09-16 14:13:45,Image
Nicest way to slay...,118719,6561,2024-11-13 23:47:22,Image
"""Teens are immature """,118498,1699,2024-10-13 20:06:33,Text
"Deadmau5 gets a random message from a 17 year old boy who wrote and provided vocals to an unreleased song. Deadmau5 decides to react to it on stream, is absolutely blown away, and instantly signs the kid. The song was eventually released and is one of deadmau5’s biggest hits to this day.",118409,2092,2024-03-18 13:16:09,Text
I Should do it myself lol,118331,258,2024-11-15 17:47:06,Text
Unusually large eruption just happened at Yellowstone National Park,118189,5599,2024-07-23 19:56:41,Text
A pro-gun candidate protecting himself from bullets while addressing to pro-gun voters.,117936,10355,2024-08-22 16:11:29,Text
"A man whose wife was lost in japan's 2011 tsunami still goes diving every week in hope of finding her body, 11 years later Yasuo Takamatsu has spent more than ten years looking for his wife Yuko's remains in order to lay her to rest. The search began after the Japan tsunami in 2011 which affected the area of Fukushima. 

Now in the years since, Takamatsu dives weekly and has done for over a decade to see if he can find her body.

Despite various searches, there has been little other clue of where Yuko's body could be but Takamatsu holds out hope

After searching on land for two and a half years, the then-56-year-old started taking diving lessons in September 2013. While he didn't find learning to dive easy, the devoted husband has explained that he's motivated by wanting to find her body

Takamatsu dives alongside the help of a diving instructor, Masayoshi Takahashi. Takahashi leads volunteer dives to look for missing tsunami victims and has been helping Takamatsu

In an interview for short film 'The Diver', Takamatsu explained: ""I do want to find her, but I also feel that she may never be discovered as the ocean is way too vast - but I have to keep looking.",117905,1154,2024-08-16 05:20:41,Image
Olympic gymnast Giorgia Villa is sponsored by parmesan and takes many photos with a wheel of cheese,117822,5480,2024-07-31 18:33:06,Text
Bro is built different,117712,487,2024-10-27 13:56:24,Text
Can't hear you,117665,548,2024-09-27 11:08:50,Image
What's the word for this colour pattern? I'm fairly sure there is a term for this type of pattern on a cat.,117695,5447,2024-09-24 01:16:51,Text
meirl,117657,448,2024-10-24 15:46:35,Text
"After son's down syndrome diagnosis, Fat Joe chooses to raise him while son's mother walks away",117529,2431,2024-10-17 22:31:18,Image
"""Victimized by the Patriarchy""",117389,1891,2024-11-15 13:38:25,Image
For me but not for thee,117042,1468,2024-10-17 12:53:58,Text
First time pouring rainbow shots,116737,675,2024-07-23 01:26:45,Text
My wedding 2017 💍,116476,1012,2024-04-09 01:42:52,Text
A woman on the phone and not paying attention to the road drove into a 1948 Jaguar XK120.,116219,9446,2024-09-28 22:25:43,Text
My window’s view looks like a painting,116304,535,2024-11-09 02:45:12,Text
"Thank you, Joe.",116163,5028,2024-07-22 01:29:41,Text
"In the newly-formed parliament in France, the youngest member, far-right MP Flavien Termet, was given the task of welcoming the deputies. Most of the deputies did not shake his hand.",116151,27284,2024-07-22 07:07:56,Text
Drones returning to their cradles/cases after a show,115912,1312,2024-10-03 09:22:59,Text
SpaceX caught Starship booster with chopsticks,115844,5870,2024-10-13 12:36:13,Text
Ozone layer,115791,2380,2024-07-27 11:34:33,Image
this woman built an apartment for cats in winter,115727,1203,2024-10-10 03:33:37,Text
"If someone cuts down a tree for their view in Australia, government installs sign to block the view",115749,1804,2024-08-28 10:54:12,Text
irrelevant daughter,115747,2108,2024-11-05 15:47:35,Text
How Trump's presidency started in 2017 and how it ended in 2021.,115639,4250,2024-11-02 15:58:19,Image
Maybe maybe maybe,115630,3755,2024-08-16 15:50:37,Text
"Same outcome, different motivation",115529,1050,2024-11-15 15:17:42,Text
:D lmao,115407,390,2024-09-07 11:12:54,Text
"In Iran, a woman who was accosted by the “morality police” for not wearing hijab removes her clothing & roams the streets in defiance. She has since been arrested by IRGC forces and forcibly disappeared.",115368,5906,2024-11-03 12:55:49,Text
"My wife says word searches are too easy, so I made her this abomination",115223,2497,2024-07-17 16:30:23,Image
"Empire State Building lit up with Darth Vader's colors on March 21, 2024. For James Earl Jones.",115169,497,2024-09-10 02:21:34,Image
Making a Halloween costume with dad,115075,1099,2024-10-17 07:14:20,Text
"Damn…. That’s like 1/1,000,000 chance lol",114982,1944,2024-10-28 12:39:02,Text
Animals without hair look quite different,114955,4853,2024-10-03 16:35:43,Text
Synchronized swimming world champion Kristina Makushenko's reprise of RayGun's (in)famous moves.,114883,2038,2024-08-22 12:00:23,Text
Umbrellas movement illustuion,114887,1158,2024-10-25 06:47:46,Text
Made it to 20 years sober! (OC)  Thanks to AA and it’s members ♥️,114686,2095,2024-09-28 04:36:43,Text
"Kotoku Wamura, mayor of a Japanese village called Fudai, was mocked for spending billions of public funds on a floodgate, until the floodgate ended up saving the village from the 2011 Japan Tsunami.",114724,1349,2024-09-03 03:23:40,Text
"[OC] Did my nails to match my tortoise Kevin’s  I was told I should cross post to this sun, so here’s Kevin and my matching manis :)",114521,797,2024-09-25 23:37:16,Text
meirl,114513,888,2024-07-31 01:38:10,Text
That's the truth,114484,4397,2024-07-12 03:21:10,Text
Using Elden Ring lingo she was taught to prank her boyfriend.,114273,1767,2024-07-17 08:14:23,Text
Meirl,114256,3359,2024-08-26 11:57:34,Image
"My wife lost her Apple Pencil four months ago. After replacing it, we just found it.",114822,3598,2024-11-19 18:24:21,Text
The shadow work on this tatoo,114000,512,2024-10-11 18:38:44,Text
Plenty of time to stop the threat. Synced video.,113933,8049,2024-07-15 13:38:20,Text
my husband left this in my camera roll for me th,113871,625,2024-10-30 01:49:05,Text
This belongs in the zeitgeist,113920,2382,2024-09-13 20:51:36,Text
I wonder what we did with the cows,113900,895,2024-08-16 00:27:23,Text
Home Alone,113899,680,2024-08-22 03:25:50,Text
My mailman left a postcard to let us know he's retiring.,113853,666,2024-09-20 21:21:57,Text
The cat was pretending all along,113615,675,2024-09-22 17:53:17,Text
Record levels of divorced dad,113544,2412,2024-09-11 12:48:29,Text
Eminems daughter Hailie got married,113463,3345,2024-05-20 18:58:46,Text
"""Feel Good"" stories",113465,933,2024-10-23 13:32:27,Text
Like nobody’s watching,113448,3243,2024-10-14 15:36:36,Text
